{
  "schemaVersion": 1,
  "siteId": "workday",
  "profileVersion": 1,
  "hosts": ["myworkdayjobs.com"],
  "roots": { "application": [] },
  "exclude": { "controls": [], "containers": [] },
  "discovery": { "fieldSelectors": [] },
  "options": { "localRootSelectors": [], "popupSelectors": [], "optionSelectors": [], "optionIdPrefix": "" },
  "filling": { "controlRootSelectors": [], "fieldRootSelectors": [], "popupOptionSelectors": [], "openActions": [] }
}
